{
  "typeOfLoss": "uk-property-fhl",
  "lossAmount": 12345.67,
  "taxYear": "2018-19",
  "lastModified": "2018-07-13T12:13:48.763Z",
  "links": [
    {
      "href": "/individuals/losses/TC663795B/brought-forward-losses/1234568790ABCDE",
      "rel": "self",
      "method": "GET"
    },
    {
      "href": "/individuals/losses/TC663795B/brought-forward-losses/1234568790ABCDE",
      "rel": "delete-brought-forward-loss",
      "method": "DELETE"
    },
    {
      "href": "/individuals/losses/TC663795B/brought-forward-losses/1234568790ABCDE/change-loss-amount",
      "rel": "amend-brought-forward-loss",
      "method": "POST"
    }
  ]
}