{
  "typeOfLoss":"self-employment-class4",
  "selfEmploymentId": "XGIS00000001319",
  "lossAmount": 12345.67,
  "taxYear": "2018-19",
  "lastModified": "2018-07-13T12:13:48.763Z",
  "links":[
    {
      "href":"/individuals/TC663795B/income-tax/losses-brought-forward/1234568790ABCDE",
      "rel":"self",
      "method":"GET"
    },
    {
      "href":"/individuals/TC663795B/income-tax/losses-brought-forward/1234568790ABCDE",
      "rel":"delete-brought-forward-loss",
      "method":"DELETE"
    },
    {
      "href":"/individuals/TC663795B/income-tax/losses-brought-forward/1234568790ABCDE/change-loss-amount",
      "rel":"amend-brought-forward-loss",
      "method":"POST"
    }
  ]
}